{
  "$schema": "https://json-schema.org/draft/2020-12/schema",
  "title": "Contract",
  "description": "Generation contract artifact.",
  "type": "object",
  "required": [
    "version",
    "generatedAt",
    "checksum",
    "frontendContract",
    "backendContract",
    "testManifest"
  ],
  "properties": {
    "version": { "type": "string" },
    "generatedAt": { "type": "string" },
    "updatedAt": { "type": "string" },
    "checksum": { "type": "string" },
    "frontendContract": {
      "type": "object",
      "required": ["window", "entities"],
      "properties": {
        "window": {
          "type": "object",
          "required": ["primaryEntity"],
          "properties": {
            "primaryEntity": { "type": ["string", "null"] },
            "vectorSearch": {
              "type": "object",
              "required": ["target"],
              "properties": {
                "target": {
                  "type": "string",
                  "pattern": "^[A-Za-z][A-Za-z0-9_.-]{0,127}$"
                }
              },
              "additionalProperties": false
            },
            "searchSuggestions": {
              "type": "array",
              "items": {
                "type": "object",
                "required": ["label", "path"],
                "properties": {
                  "label": { "type": "string", "minLength": 1 },
                  "path": { "type": "string", "pattern": "^/" }
                },
                "additionalProperties": false
              }
            }
          },
          "additionalProperties": true
        },
        "entities": {
          "type": "object",
          "additionalProperties": {
            "type": "object",
            "required": ["fields", "searchableFields", "computedFields"],
            "properties": {
              "fields": {
                "type": "array",
                "items": {
                  "type": "object",
                  "required": ["name", "type", "visibility", "required", "grid", "form"],
                  "properties": {
                    "name": { "type": "string" },
                    "apiKey": { "type": "string" },
                    "column": { "type": "string" },
                    "label": { "type": "string" },
                    "type": { "type": "string" },
                    "tsType": { "type": "string" },
                    "visibility": { "type": "string" },
                    "required": { "type": "boolean" },
                    "sourceRequired": { "type": "boolean" },
                    "grid": { "type": "boolean" },
                    "form": { "type": "boolean" },
                    "defaultValue": {},
                    "reference": { "type": "string" },
                    "inputMode": { "type": "string" },
                    "lookup": { "type": "boolean" },
                    "popup": { "type": "boolean" },
                    "section": { "type": "string" },
                    "seq": { "type": "number" },
                    "derivation": {
                      "type": "object",
                      "required": ["type"],
                      "properties": {
                        "type": { "type": "string" },
                        "source": {}
                      },
                      "additionalProperties": true
                    },
                    "callout": {
                      "type": "object",
                      "properties": {
                        "className": { "type": "string" }
                      },
                      "additionalProperties": true
                    },
                    "displayLogic": { "type": "object", "additionalProperties": true },
                    "readOnlyLogic": { "type": "object", "additionalProperties": true }
                  },
                  "additionalProperties": true
                }
              },
              "searchableFields": {
                "type": "array",
                "items": { "type": "string" }
              },
              "computedFields": {
                "type": "array",
                "items": {
                  "type": "object",
                  "required": ["name", "derivation"],
                  "properties": {
                    "name": { "type": "string" },
                    "derivation": {
                      "type": "object",
                      "required": ["type"],
                      "properties": {
                        "type": { "type": "string" },
                        "source": {}
                      },
                      "additionalProperties": true
                    }
                  },
                  "additionalProperties": true
                }
              },
              "draftMode": { "type": "object", "additionalProperties": true }
            },
            "additionalProperties": true
          }
        }
      },
      "additionalProperties": true
    },
    "backendContract": {
      "type": "object",
      "required": ["window", "entities"],
      "properties": {
        "window": { "type": "object", "additionalProperties": true },
        "entities": { "type": "object", "additionalProperties": true },
        "endpoints": { "type": "array", "items": { "type": "object", "additionalProperties": true } },
        "processEndpoints": { "type": "array", "items": { "type": "object", "additionalProperties": true } }
      },
      "additionalProperties": true
    },
    "apiPrediction": {
      "type": "object",
      "properties": {
        "selectors": { "type": "array", "items": { "type": "object", "additionalProperties": true } },
        "actions": { "type": "array", "items": { "type": "object", "additionalProperties": true } },
        "crud": { "type": "object", "additionalProperties": { "type": "object", "additionalProperties": true } }
      },
      "additionalProperties": true
    },
    "formState": {
      "type": "object",
      "required": ["entities"],
      "properties": {
        "entities": {
          "type": "object",
          "additionalProperties": {
            "type": "object",
            "required": ["fields"],
            "properties": {
              "fields": {
                "type": "object",
                "additionalProperties": {
                  "type": "object",
                  "properties": {
                    "visible": { "type": "boolean" },
                    "readOnly": { "type": "boolean" },
                    "required": { "type": "boolean" },
                    "displayLogic": { "type": "string" },
                    "readOnlyLogic": { "type": "string" },
                    "calloutTriggers": {
                      "type": "array",
                      "items": { "type": "string" }
                    },
                    "defaultValue": {}
                  },
                  "additionalProperties": false
                }
              }
            },
            "additionalProperties": true
          }
        }
      },
      "additionalProperties": true
    },
    "agentProfile": {
      "type": "object",
      "properties": {
        "window": { "type": "object", "additionalProperties": true },
        "entities": { "type": "object", "additionalProperties": true },
        "capabilities": { "type": "array", "items": { "type": "string" } },
        "warnings": { "type": "array", "items": { "type": "string" } }
      },
      "additionalProperties": true
    },
    "testManifest": {
      "type": "object",
      "required": ["tests", "summary"],
      "properties": {
        "tests": { "type": "array", "items": { "type": "object", "additionalProperties": true } },
        "summary": { "type": "object", "additionalProperties": true }
      },
      "additionalProperties": true
    }
  },
  "additionalProperties": false
}
