{
  "version": "0.4.0",
  "generatedAt": "2026-04-28T16:08:39.756Z",
  "updatedAt": "2026-07-22T15:18:31.203Z",
  "checksum": "f6412bc60aa81588",
  "frontendContract": {
    "window": {
      "id": "C327DE215AC945F69363905840118177",
      "name": "TBAI Config",
      "primaryEntity": "header",
      "category": "configuration",
      "attachments": false,
      "layoutType": "default"
    },
    "entities": {
      "header": {
        "tableName": "TBAI_Config",
        "tabId": "6E0100DFD42149C7A1BCCF452018B380",
        "tabName": "Header",
        "uiPattern": "STD",
        "fields": [
          {
            "name": "etsgSifTerritory",
            "apiKey": "etsgSifTerritory",
            "column": "ETSG_SIF_Territory",
            "label": "Territorio SIF",
            "type": "enum",
            "tsType": "string",
            "visibility": "readOnly",
            "required": false,
            "grid": false,
            "form": true,
            "enumValues": [
              {
                "value": "AEAT",
                "name": "AEAT (Agencia Estatal de Administración Tributaria)"
              },
              {
                "value": "ARABA",
                "name": "Araba/Álava (Hacienda Foral de Álava)"
              },
              {
                "value": "BIZKAIA",
                "name": "Bizkaia (Hacienda Foral de Bizkaia)"
              },
              {
                "value": "GIPUZKOA",
                "name": "Gipuzkoa (Hacienda Foral de Gipuzkoa)"
              },
              {
                "value": "IGIC",
                "name": "IGIC (Islas Canarias)"
              },
              {
                "value": "NAVARRA",
                "name": "Navarra (Hacienda Foral de Navarra)"
              }
            ],
            "validation": {
              "maxLength": 60
            },
            "validationRule": {
              "code": "AD_Ref_List.Value IN ('ARABA', 'BIZKAIA', 'GIPUZKOA')",
              "contextParams": [],
              "cascadeParams": []
            }
          },
          {
            "name": "tbaisystemdate",
            "apiKey": "tbaisystemdate",
            "column": "Tbaisystemdate",
            "label": "Fecha Acogida TBAI",
            "type": "date",
            "tsType": "string",
            "visibility": "editable",
            "required": true,
            "grid": false,
            "form": true,
            "sourceRequired": true,
            "derivation": {
              "type": "computed",
              "source": "@#Date@"
            },
            "defaultValue": "@#Date@",
            "validation": {
              "required": true,
              "maxLength": 19
            }
          },
          {
            "name": "productionEnv",
            "apiKey": "productionEnv",
            "column": "Production_Env",
            "label": "Entorno de Producción",
            "type": "boolean",
            "tsType": "boolean",
            "visibility": "editable",
            "required": true,
            "grid": false,
            "form": true,
            "sourceRequired": true,
            "derivation": {
              "type": "computed",
              "source": "Y"
            },
            "defaultValue": "Y",
            "validation": {
              "required": true,
              "maxLength": 1
            }
          },
          {
            "name": "invoiceDescription",
            "apiKey": "invoiceDescription",
            "column": "Invoice_Description",
            "label": "Descripción de Facturas",
            "type": "string",
            "tsType": "string",
            "visibility": "editable",
            "required": true,
            "grid": false,
            "form": true,
            "sourceRequired": true,
            "derivation": {
              "type": "computed",
              "source": "Descripcion Factura"
            },
            "defaultValue": "Descripcion Factura",
            "validation": {
              "required": true,
              "maxLength": 60
            }
          },
          {
            "name": "uSEAsproductDesc",
            "apiKey": "uSEAsproductDesc",
            "column": "USE_Asproduct_Desc",
            "label": "Utilizar descripción también para nombre producto",
            "type": "boolean",
            "tsType": "boolean",
            "visibility": "editable",
            "required": true,
            "grid": false,
            "form": true,
            "sourceRequired": true,
            "derivation": {
              "type": "computed",
              "source": "N"
            },
            "defaultValue": "N",
            "validation": {
              "required": true,
              "maxLength": 1
            }
          },
          {
            "name": "autoSendInvoices",
            "apiKey": "autoSendInvoices",
            "column": "Auto_Send_Invoices",
            "label": "Auto enviar facturas al completarse",
            "type": "boolean",
            "tsType": "boolean",
            "visibility": "editable",
            "required": true,
            "grid": false,
            "form": true,
            "sourceRequired": true,
            "derivation": {
              "type": "computed",
              "source": "N"
            },
            "defaultValue": "N",
            "validation": {
              "required": true,
              "maxLength": 1
            }
          },
          {
            "name": "jasperreportPath",
            "apiKey": "jasperreportPath",
            "column": "Jasperreport_Path",
            "label": "Ruta de Reporte Jasper",
            "type": "string",
            "tsType": "string",
            "visibility": "editable",
            "required": false,
            "grid": false,
            "form": true,
            "validation": {
              "maxLength": 500
            }
          },
          {
            "name": "validatePreviousInvoice",
            "apiKey": "validatePreviousInvoice",
            "column": "Validate_Previous_Invoice",
            "label": "Validar factura anterior",
            "type": "boolean",
            "tsType": "boolean",
            "visibility": "editable",
            "required": true,
            "grid": false,
            "form": true,
            "sourceRequired": true,
            "derivation": {
              "type": "computed",
              "source": "N"
            },
            "defaultValue": "N",
            "validation": {
              "required": true,
              "maxLength": 1
            }
          }
        ],
        "searchableFields": [],
        "computedFields": [
          {
            "name": "tbaisystemdate",
            "derivation": {
              "type": "computed",
              "source": "@#Date@"
            }
          },
          {
            "name": "productionEnv",
            "derivation": {
              "type": "computed",
              "source": "Y"
            }
          },
          {
            "name": "invoiceDescription",
            "derivation": {
              "type": "computed",
              "source": "Descripcion Factura"
            }
          },
          {
            "name": "uSEAsproductDesc",
            "derivation": {
              "type": "computed",
              "source": "N"
            }
          },
          {
            "name": "autoSendInvoices",
            "derivation": {
              "type": "computed",
              "source": "N"
            }
          },
          {
            "name": "validatePreviousInvoice",
            "derivation": {
              "type": "computed",
              "source": "N"
            }
          }
        ],
        "javaQualifier": "tbai-config-sequence-handler"
      }
    }
  },
  "backendContract": {
    "window": {
      "id": "C327DE215AC945F69363905840118177",
      "name": "TBAI Config",
      "primaryEntity": "header",
      "category": "configuration",
      "attachments": false
    },
    "entities": {
      "header": {
        "tableName": "TBAI_Config",
        "tabId": "6E0100DFD42149C7A1BCCF452018B380",
        "tabName": "Header",
        "fields": [
          {
            "name": "organization",
            "apiKey": "organization",
            "column": "AD_Org_ID",
            "type": "foreignKey",
            "visibility": "system",
            "required": true
          },
          {
            "name": "active",
            "apiKey": "active",
            "column": "Isactive",
            "type": "boolean",
            "visibility": "system",
            "required": true
          },
          {
            "name": "etsgSifTerritory",
            "apiKey": "etsgSifTerritory",
            "column": "ETSG_SIF_Territory",
            "type": "enum",
            "visibility": "readOnly",
            "required": false
          },
          {
            "name": "tbaisystemdate",
            "apiKey": "tbaisystemdate",
            "column": "Tbaisystemdate",
            "type": "date",
            "visibility": "editable",
            "required": true
          },
          {
            "name": "productionEnv",
            "apiKey": "productionEnv",
            "column": "Production_Env",
            "type": "boolean",
            "visibility": "editable",
            "required": true
          },
          {
            "name": "invoiceDescription",
            "apiKey": "invoiceDescription",
            "column": "Invoice_Description",
            "type": "string",
            "visibility": "editable",
            "required": true
          },
          {
            "name": "uSEAsproductDesc",
            "apiKey": "uSEAsproductDesc",
            "column": "USE_Asproduct_Desc",
            "type": "boolean",
            "visibility": "editable",
            "required": true
          },
          {
            "name": "autoSendInvoices",
            "apiKey": "autoSendInvoices",
            "column": "Auto_Send_Invoices",